{"$schema":"https://json-schema.org/draft/2020-12/schema","type":"object","required":["case_id","claim_layer","family","provider_contract","subject_adapter","stimulus","expected"],"properties":{"case_id":{"type":"string","minLength":1},"claim_layer":{"type":"string","minLength":1},"family":{"const":"denied"},"provider_contract":{"type":"string","minLength":1},"subject_adapter":{"type":"string","minLength":1},"stimulus":{"type":"object","required":["operation","required_capability","pre_state"],"properties":{"operation":{"const":"deny-knowledge-mutation"},"required_capability":{"type":"string","minLength":1},"pre_state":{"type":"object"}},"additionalProperties":false},"expected":{"type":"object","required":["failure_code","post_state"],"properties":{"failure_code":{"const":"capability-denied"},"post_state":{"type":"object"}},"additionalProperties":false}},"additionalProperties":false}
