{"case_id":"knowledge-non-interference-denied","claim_layer":"knowledge-non-interference","family":"denied","provider_contract":"pigloros.fixture.knowledge-non-interference@1.0.0","subject_adapter":"exported-artifact","stimulus":{"operation":"deny-knowledge-mutation","required_capability":"mutate-subject","pre_state":{"revision":1}},"expected":{"failure_code":"capability-denied","post_state":{"revision":1}}}
